{
  "schema_version": "codenoesis.federation-report/v1",
  "analysis_profile": "standard-local-s6",
  "contract_capability": "codenoesis.contract-capability/openapi-3.1-http-json/v1",
  "federation_rule_catalog": "codenoesis.federation-rules/http-json/v1",
  "workspace_identity": "urn:codenoesis:fixture:s6-openapi-federation-v1",
  "provider": {
    "repository_identity": "urn:codenoesis:fixture:s7-provider",
    "revision": "fixture-provider-a",
    "contract_path": "provider/openapi.yaml",
    "contract_sha256": "d6decc18d428316b209aa554ee028fe9db8761df515bf34b9e92c3a369f2de3d",
    "source_format": "yaml",
    "service_id": "urn:codenoesis:service:blake3:509813cd6e049acb2c9de79cb9f0a1f385b355473512592a22d5f115ac9243cc",
    "service_authority": "https://api.example.invalid",
    "evidence_ids": [
      "urn:codenoesis:evidence:blake3:36e6771d66d0c86f9dee560713c4dfab20e4930a4d6fa093fb5076539c372dcf",
      "urn:codenoesis:evidence:blake3:649dce60ffe264f21ba96bf3f95c0ac5a99c8936377ffc4ed102d1c0cae646e4",
      "urn:codenoesis:evidence:blake3:7ad84b96363e0102c20212c0dbff3e8632232460df32744cbd8227a68d0de846"
    ]
  },
  "operations": [
    {
      "operation_id": "urn:codenoesis:operation:blake3:071cbb8fa33a959879d7d8a2bfbbac31e1fea4850c28fdb73227c605f5974923",
      "service_id": "urn:codenoesis:service:blake3:509813cd6e049acb2c9de79cb9f0a1f385b355473512592a22d5f115ac9243cc",
      "method": "GET",
      "path_template": "/users/{id}",
      "explicit_operation_id": "getUser",
      "response_status": "200",
      "schema_id": "urn:codenoesis:schema:blake3:d5ccc3bfeafd3668993d4a6f520231d62b47ca63dbac467b5ea1d23d13032c68",
      "fields": [
        {
          "field_id": "urn:codenoesis:field:blake3:18ccd66ca65b4c53a46dfb46b7f376985a376e24e6d1dd1d5614dedeca73d88c",
          "json_pointer": "/id",
          "required": true,
          "type": "string",
          "evidence_ids": [
            "urn:codenoesis:evidence:blake3:7ad84b96363e0102c20212c0dbff3e8632232460df32744cbd8227a68d0de846"
          ]
        },
        {
          "field_id": "urn:codenoesis:field:blake3:a2b6cafe0db73cb016ffd790941c18fbab768923a5b8b4b671eb22459ec66301",
          "json_pointer": "/nickname",
          "required": false,
          "type": "string",
          "evidence_ids": [
            "urn:codenoesis:evidence:blake3:7ad84b96363e0102c20212c0dbff3e8632232460df32744cbd8227a68d0de846"
          ]
        },
        {
          "field_id": "urn:codenoesis:field:blake3:a4bef896d066ecb3441a6d9638cea00947075d62c66bad642455840a7ce4f0e7",
          "json_pointer": "/displayName",
          "required": false,
          "type": "string",
          "evidence_ids": [
            "urn:codenoesis:evidence:blake3:7ad84b96363e0102c20212c0dbff3e8632232460df32744cbd8227a68d0de846"
          ]
        }
      ],
      "evidence_ids": [
        "urn:codenoesis:evidence:blake3:36e6771d66d0c86f9dee560713c4dfab20e4930a4d6fa093fb5076539c372dcf",
        "urn:codenoesis:evidence:blake3:7ad84b96363e0102c20212c0dbff3e8632232460df32744cbd8227a68d0de846"
      ]
    }
  ],
  "clients": [
    {
      "role": "decoy",
      "repository_identity": "urn:codenoesis:fixture:s7-client-decoy",
      "revision": "fixture-client-v1",
      "client_id": "urn:codenoesis:client:blake3:03879c99edb3bb0d0a2f5af4d6d842f21cf6232ee9efb60aed5c375f625100ea",
      "call_site_id": "urn:codenoesis:call-site:blake3:0f3124309b75ad804310cfbf01feb1a7fa23f9deb98dad9dfdf43a8213ce7031",
      "declaration_path": "clients/decoy/federation.json",
      "binding_kind": "explicit_operation_identity",
      "operation_candidate_id": "urn:codenoesis:operation:blake3:6f93dc5d0322acb97f64f57d08f317e1e6d0b66a1f4c89157c42598ac7e855fa",
      "evidence_ids": [
        "urn:codenoesis:evidence:blake3:1d1e5f6fd4157c6870a947133d008b8763b1f73173495e0fa8fb0ff771b50eb2"
      ]
    },
    {
      "role": "candidate",
      "repository_identity": "urn:codenoesis:fixture:s6-client-candidate",
      "revision": "fixture-client-v1",
      "client_id": "urn:codenoesis:client:blake3:a1f864a4d35d7feb5b30ae1d732cfce92cc2b7942a201f835ff27f857eba99dd",
      "call_site_id": "urn:codenoesis:call-site:blake3:9e1975f4d280747353201b2500563ccac478a9903d9fb78662e8736701f41e3b",
      "declaration_path": "clients/candidate/federation.json",
      "binding_kind": "heuristic_name",
      "operation_candidate_id": null,
      "evidence_ids": [
        "urn:codenoesis:evidence:blake3:916f40d6f6b4b0d4dbe1f43c4fa72d063504652177f28586174feb8a8012aad1"
      ]
    },
    {
      "role": "safe",
      "repository_identity": "urn:codenoesis:fixture:s7-client-safe",
      "revision": "fixture-client-v1",
      "client_id": "urn:codenoesis:client:blake3:bc61c394bfca258f571afdc1ff8a69cbe141c0f093942c031392157568d937b0",
      "call_site_id": "urn:codenoesis:call-site:blake3:bf63c10163327564a50f45606830ab57d450e2c8480cc170eb30bb21891b661c",
      "declaration_path": "clients/safe/federation.json",
      "binding_kind": "explicit_operation_identity",
      "operation_candidate_id": "urn:codenoesis:operation:blake3:071cbb8fa33a959879d7d8a2bfbbac31e1fea4850c28fdb73227c605f5974923",
      "evidence_ids": [
        "urn:codenoesis:evidence:blake3:93c77578a5ab75452a40a3e68c2249aba4e91b629bf6347f486f79860d4522a2"
      ]
    },
    {
      "role": "strict",
      "repository_identity": "urn:codenoesis:fixture:s7-client-strict",
      "revision": "fixture-client-v1",
      "client_id": "urn:codenoesis:client:blake3:ebd716cc12c29ad94e757a84d525b057f53ab8d3e6f9e21a35ffa55a6b8057a9",
      "call_site_id": "urn:codenoesis:call-site:blake3:a59693122eeb35ee111acb47cfa2a20eafb4c75746ed60ae9ed61aa4e859884b",
      "declaration_path": "clients/strict/federation.json",
      "binding_kind": "explicit_operation_identity",
      "operation_candidate_id": "urn:codenoesis:operation:blake3:071cbb8fa33a959879d7d8a2bfbbac31e1fea4850c28fdb73227c605f5974923",
      "evidence_ids": [
        "urn:codenoesis:evidence:blake3:599b60f8065e4a468fcfe8bee60c7d35aea481d9d7240c81a73a46a1ed51eb27"
      ]
    }
  ],
  "confirmed_links": [
    {
      "link_id": "urn:codenoesis:federation-link:blake3:547cc41b35899ae369bda4d2fcd26eb907cde7f9e11dcfbbcf7546c2dc8745c4",
      "operation_id": "urn:codenoesis:operation:blake3:071cbb8fa33a959879d7d8a2bfbbac31e1fea4850c28fdb73227c605f5974923",
      "client_id": "urn:codenoesis:client:blake3:ebd716cc12c29ad94e757a84d525b057f53ab8d3e6f9e21a35ffa55a6b8057a9",
      "call_site_id": "urn:codenoesis:call-site:blake3:a59693122eeb35ee111acb47cfa2a20eafb4c75746ed60ae9ed61aa4e859884b",
      "authority": "explicit_workspace_identity",
      "rule_id": "fed.explicit-operation.confirm/v1",
      "state": "confirmed",
      "evidence_ids": [
        "urn:codenoesis:evidence:blake3:36e6771d66d0c86f9dee560713c4dfab20e4930a4d6fa093fb5076539c372dcf",
        "urn:codenoesis:evidence:blake3:599b60f8065e4a468fcfe8bee60c7d35aea481d9d7240c81a73a46a1ed51eb27"
      ]
    },
    {
      "link_id": "urn:codenoesis:federation-link:blake3:6e1a9994d26cc9e144557600f2ddf3d6686980d1b2eb599d10655336cf5d47f0",
      "operation_id": "urn:codenoesis:operation:blake3:071cbb8fa33a959879d7d8a2bfbbac31e1fea4850c28fdb73227c605f5974923",
      "client_id": "urn:codenoesis:client:blake3:bc61c394bfca258f571afdc1ff8a69cbe141c0f093942c031392157568d937b0",
      "call_site_id": "urn:codenoesis:call-site:blake3:bf63c10163327564a50f45606830ab57d450e2c8480cc170eb30bb21891b661c",
      "authority": "explicit_workspace_identity",
      "rule_id": "fed.explicit-operation.confirm/v1",
      "state": "confirmed",
      "evidence_ids": [
        "urn:codenoesis:evidence:blake3:36e6771d66d0c86f9dee560713c4dfab20e4930a4d6fa093fb5076539c372dcf",
        "urn:codenoesis:evidence:blake3:93c77578a5ab75452a40a3e68c2249aba4e91b629bf6347f486f79860d4522a2"
      ]
    }
  ],
  "candidates": [
    {
      "candidate_id": "urn:codenoesis:federation-candidate:blake3:9af77b3dd913e25e68cc0eaca2a8ceacc07328e5efb303735383fd2e8f0aff23",
      "target_operation_id": "urn:codenoesis:operation:blake3:071cbb8fa33a959879d7d8a2bfbbac31e1fea4850c28fdb73227c605f5974923",
      "client_id": "urn:codenoesis:client:blake3:a1f864a4d35d7feb5b30ae1d732cfce92cc2b7942a201f835ff27f857eba99dd",
      "call_site_id": "urn:codenoesis:call-site:blake3:9e1975f4d280747353201b2500563ccac478a9903d9fb78662e8736701f41e3b",
      "authority": "heuristic_candidate",
      "service_hint": "Fixture User Service",
      "operation_hint": "getUser",
      "rule_id": "fed.heuristic-name.candidate/v1",
      "state": "candidate",
      "evidence_ids": [
        "urn:codenoesis:evidence:blake3:36e6771d66d0c86f9dee560713c4dfab20e4930a4d6fa093fb5076539c372dcf",
        "urn:codenoesis:evidence:blake3:916f40d6f6b4b0d4dbe1f43c4fa72d063504652177f28586174feb8a8012aad1"
      ],
      "coverage_gap_id": "urn:codenoesis:coverage-gap:blake3:ee1d72e3795815f1009c9818f06ae351bbdf5f893ba8498c01ae78577f5c19da"
    }
  ],
  "rejections": [
    {
      "rejection_id": "urn:codenoesis:federation-rejection:blake3:f01d2d69ee0848056629b2763381377f47510a152d03c7bd6e3ecb7ab676d165",
      "operation_candidate_id": "urn:codenoesis:operation:blake3:6f93dc5d0322acb97f64f57d08f317e1e6d0b66a1f4c89157c42598ac7e855fa",
      "client_id": "urn:codenoesis:client:blake3:03879c99edb3bb0d0a2f5af4d6d842f21cf6232ee9efb60aed5c375f625100ea",
      "call_site_id": "urn:codenoesis:call-site:blake3:0f3124309b75ad804310cfbf01feb1a7fa23f9deb98dad9dfdf43a8213ce7031",
      "reason_code": "operation_not_exposed",
      "rule_id": "fed.operation-decoy.reject/v1",
      "state": "rejected",
      "evidence_ids": [
        "urn:codenoesis:evidence:blake3:1d1e5f6fd4157c6870a947133d008b8763b1f73173495e0fa8fb0ff771b50eb2",
        "urn:codenoesis:evidence:blake3:36e6771d66d0c86f9dee560713c4dfab20e4930a4d6fa093fb5076539c372dcf"
      ]
    }
  ],
  "evidence": [
    {